{
  "proposal_id": "proposal-1",
  "user_id": "user-1",
  "proposal_status": "active",
  "project_title": "AI intake readiness assistant",
  "goal": "Reduce manual reconciliation before clinical AI project review.",
  "structured_brief": {
    "project_title": "AI intake readiness assistant",
    "goal": "Reduce manual reconciliation before clinical AI project review.",
    "target_user": "Clinical innovation project leads",
    "problem_owner": "Innovation intake team",
    "problem_statement": "Project leads submit fragmented descriptions that delay review readiness checks.",
    "evidence_of_problem": "Three service leads reported recurring reconciliation delays in the last intake cycle.",
    "current_alternatives": "Manual review meetings and spreadsheet notes.",
    "scope": "Early Alpha intake for problem and solution definition only.",
    "constraints_known": [
      "Local execution",
      "No patient data"
    ],
    "assumptions": [
      "Teams can provide non-sensitive project descriptions"
    ],
    "ambiguities": [
      "Baseline review delay still needs quantification"
    ],
    "missing_information": [
      "Exact frequency of incomplete submissions"
    ]
  },
  "documents": [
    {
      "document_id": "document-1",
      "proposal_id": "proposal-1",
      "source_kind": "pasted_text",
      "document_status": "normalized",
      "pasted_text": "Clinicians spend several hours each week reconciling fragmented intake notes before AI project review.",
      "normalized_text": "Clinicians spend several hours each week reconciling fragmented intake notes before AI project review.",
      "warnings": [],
      "created_at": "2026-05-24T14:00:00.000Z"
    }
  ],
  "sources": [
    {
      "source_id": "source-1",
      "source_kind": "pasted_text",
      "label": "Initial proposal text",
      "document_id": "document-1",
      "created_at": "2026-05-24T14:00:00.000Z"
    }
  ],
  "gaps": [
    {
      "gap_id": "gap-1",
      "proposal_id": "proposal-1",
      "module": "problem",
      "gap_kind": "missing_information",
      "gap_status": "open",
      "origin": "structured_brief_field",
      "field": "evidence_of_problem",
      "description": "The proposal needs clearer evidence that the intake delay is frequent and material.",
      "absence": {
        "is_absent": true,
        "checked_fields": [
          "evidence_of_problem"
        ],
        "reason": "Required information was not found in the available structured brief."
      },
      "source_refs": [],
      "audit_refs": [
        {
          "kind": "agent_run",
          "id": "run-1"
        }
      ],
      "warnings": [],
      "created_at": "2026-05-24T14:05:00.000Z",
      "updated_at": "2026-05-24T14:05:00.000Z"
    }
  ],
  "module_chats": [
    {
      "chat_id": "chat-1",
      "proposal_id": "proposal-1",
      "module": "problem",
      "chat_status": "waiting_for_user",
      "turns": [],
      "active_turn_id": "turn-1",
      "started_at": "2026-05-24T14:10:00.000Z",
      "warnings": []
    }
  ],
  "generated_sections": [
    {
      "section_id": "section-problem-1",
      "proposal_id": "proposal-1",
      "section_kind": "problem",
      "section_status": "generated",
      "title": "Problem definition",
      "content_markdown": "Clinical AI intake reviews are delayed because teams reconcile fragmented notes manually before review.",
      "source_refs": [
        {
          "source_id": "source-1",
          "source_kind": "pasted_text",
          "label": "Initial proposal text",
          "document_id": "document-1",
          "created_at": "2026-05-24T14:00:00.000Z"
        }
      ],
      "gap_refs": [
        "gap-1"
      ],
      "generated_by_run_id": "run-2",
      "warnings": [],
      "created_at": "2026-05-24T14:20:00.000Z"
    }
  ],
  "audit_refs": [
    {
      "kind": "snapshot",
      "id": "snapshot-1"
    }
  ],
  "warnings": [],
  "schema_version": "alpha-model.v1",
  "created_at": "2026-05-24T14:00:00.000Z",
  "updated_at": "2026-05-24T14:20:00.000Z",
  "metadata": {
    "contract_only": true
  }
}
